{
  "$schema": "http://json-schema.org/draft-07/schema#",
  "title": "Ballpuzzle4 Container v1.0",
  "type": "object",
  "required": ["version", "lattice", "cells", "cid", "designer"],
  "additionalProperties": false,
  "properties": {
    "version": { "type": "string", "enum": ["1.0"] },
    "lattice": { "type": "string", "enum": ["fcc"] },
    "cells": {
      "type": "array",
      "minItems": 1,
      "items": {
        "type": "array",
        "minItems": 3,
        "maxItems": 3,
        "items": { "type": "integer" }
      }
    },
    "cid": {
      "type": "string",
      "pattern": "^sha256:[a-f0-9]{64}$"
    },
    "designer": {
      "type": "object",
      "required": ["name", "date"],
      "properties": {
        "name": { "type": "string" },
        "date": { "type": "string", "format": "date" },
        "email": { "type": "string", "format": "email" }
      },
      "additionalProperties": false
    }
  }
}
