{
  "version": "1.0",
  "lattice": "fcc",
  "cells": [
    [
      0,
      0,
      2
    ],
    [
      0,
      1,
      1
    ],
    [
      0,
      2,
      0
    ],
    [
      1,
      0,
      3
    ],
    [
      1,
      1,
      2
    ],
    [
      1,
      2,
      1
    ],
    [
      2,
      2,
      2
    ],
    [
      3,
      2,
      3
    ],
    [
      3,
      3,
      2
    ]
  ],
  "cid": "sha256:151aadf00412b820f6ec85adbd34c3028e60ae94d5ed97cb260f6976e16d3607",
  "designer": {
    "name": "Anton Bakker",
    "date": "2025-09-12"
  }
}